### ISSUE TITLE
OpenWeatherMap api

### ISSUE THREAD

**Issue by dianlujitao** [gfwlist/gfwlist#973]
Please consider adding api.openweathermap.org

I can ping and access it using a web browser, but [gnome-shell-extension-openweather](https://github.com/jenslody/gnome-shell-extension-openweather) can't fetch weather data from it. Packets are dropped after handshake.

Here's wireshark dump:
```
9	3.718451498	192.168.1.177	192.168.1.1	DNS	82	Standard query 0x040c A api.openweathermap.org
10	3.718471819	192.168.1.177	192.168.1.1	DNS	82	Standard query 0x7e14 AAAA api.openweathermap.org
14	3.812758337	192.168.1.1	192.168.1.177	DNS	114	Standard query response 0x040c A api.openweathermap.org A 192.241.169.168 A 162.243.53.59
15	3.823126977	192.168.1.1	192.168.1.177	DNS	169	Standard query response 0x7e14 AAAA api.openweathermap.org SOA ns-1790.awsdns-31.co.uk
16	3.823576313	192.168.1.177	192.241.169.168	TCP	74	54682 → 443 [SYN] Seq=0 Win=29200 Len=0 MSS=1460 SACK_PERM=1 TSval=2213127546 TSecr=0 WS=128
21	4.204481094	192.241.169.168	192.168.1.177	TCP	74	443 → 54682 [SYN, ACK] Seq=0 Ack=1 Win=28960 Len=0 MSS=1024 SACK_PERM=1 TSval=3637429640 TSecr=2213127546 WS=256
22	4.204529704	192.168.1.177	192.241.169.168	TCP	66	54682 → 443 [ACK] Seq=1 Ack=1 Win=29312 Len=0 TSval=2213127927 TSecr=3637429640
23	4.204990447	192.168.1.177	192.241.169.168	TLSv1	587	Client Hello
28	5.189594697	192.168.1.177	192.241.169.168	TCP	587	[TCP Retransmission] 54682 → 443 [PSH, ACK] Seq=1 Ack=1 Win=29312 Len=521 TSval=2213128912 TSecr=3637429640
29	6.341580030	192.168.1.177	192.241.169.168	TCP	587	[TCP Retransmission] 54682 → 443 [PSH, ACK] Seq=1 Ack=1 Win=29312 Len=521 TSval=2213130064 TSecr=3637429640
44	8.645600844	192.168.1.177	192.241.169.168	TCP	587	[TCP Retransmission] 54682 → 443 [PSH, ACK] Seq=1 Ack=1 Win=29312 Len=521 TSval=2213132368 TSecr=3637429640
```

After locally adding the URL to my list it works as expected.
